variant,hook,script,cta,url
1,"Tu payes trop cher ta box ?","Regarde ta facture internet. Si la promo est finie, si tu as la TV sans l’utiliser ou si tu payes plus de 35 euros par mois, ça vaut le coup de comparer. Sur Comparia, tu choisis box internet, box + mobile ou box + TV et tu vois les options utiles.","Compare ta box gratuitement","https://www.comparetesfactures.fr/guides/facture-box-trop-chere"
2,"Ton forfait mobile est trop gros","Beaucoup de gens payent 100 Go ou plus alors qu’ils utilisent beaucoup moins. Vérifie ta data réelle sur les trois derniers mois, puis compare un forfait adapté. Le bon forfait, c’est celui que tu utilises vraiment.","Teste le comparateur mobile","https://www.comparetesfactures.fr/guides/facture-mobile-trop-chere"
3,"Assurance habitation qui augmente ?","Si ton assurance habitation augmente alors que ton logement n’a pas changé, compare avant de renouveler. Regarde la franchise, les exclusions et les garanties essentielles. Le moins cher n’est pas toujours le meilleur, mais l’ancien contrat n’est pas toujours le bon.","Compare ton assurance habitation","https://www.comparetesfactures.fr/guides/assurance-habitation-augmentation"
4,"Objectif 300 euros par an","Tu peux parfois économiser sans changer ton mode de vie : box, mobile, assurance auto, habitation, énergie, banque. Le secret, c’est de savoir quelle facture vérifier en premier.","Fais le diagnostic gratuit","https://www.comparetesfactures.fr/guides/economiser-300-euros-par-an"
5,"Frontaliers Suisse, attention au change","Si tu gagnes en CHF et dépenses en euros, le taux de change peut te coûter cher chaque mois. Même une petite différence devient importante sur l’année. Compare les solutions CHF/EUR avant de laisser ta banque décider.","Compare le change CHF/EUR","https://www.comparetesfactures.fr/guides/frontalier-change-chf-eur"
6,"Banque gratuite, vraiment ?","Une banque en ligne gratuite peut être intéressante, mais vérifie la carte, les retraits, les paiements à l’étranger, les conditions d’usage et l’application. Gratuit ne veut pas dire identique.","Compare les banques","https://www.comparetesfactures.fr/guides/banque-en-ligne-gratuite"
7,"Électricité : ne regarde pas que la mensualité","Pour comparer l’électricité, regarde le prix annuel estimé, la stabilité, ton type de logement et ton objectif : payer moins, prix stable ou offre verte. La mensualité seule peut tromper.","Compare l’électricité","https://www.comparetesfactures.fr/guides/changer-fournisseur-electricite"
8,"Abonnements oubliés","Streaming, apps, sport, logiciels : les petites lignes finissent par coûter cher. Fais la liste des prélèvements des trois derniers mois et supprime ce qui ne sert plus.","Vérifie tes abonnements","https://www.comparetesfactures.fr/guides/reduire-abonnements-mensuels"
9,"Assurance auto : ne baisse pas tout","Pour payer moins cher, ne supprime pas les garanties au hasard. Compare l’usage, la valeur de la voiture, les franchises et l’assistance. Une économie doit rester logique.","Compare l’assurance auto","https://www.comparetesfactures.fr/guides/assurance-auto-prix-augmente"
10,"Quelle facture comparer en premier ?","Si tu ne sais pas par où commencer, regarde les contrats les plus anciens ou ceux qui ont augmenté : assurance, box, énergie, mobile, banque. Comparia t’aide à choisir le bon ordre.","Lance Comparia","https://www.comparetesfactures.fr/guides/comparateur-factures-maison"
